,category,title,score,id,url,comment
0,controversial,"Woman grows giant pumpkins in her front yard, Is surprised when someone destroys them.",1.0,z6i7j,http://www.dailynews.com/news/ci_21444983/pasadena-womans-prize-winning-pumpkins-destroyed,0.0
1,controversial,Thought of this while working outside today,0.0,12r91w,http://www.quickmeme.com/meme/3ro1o1/,0.0
2,controversial,r/Gardening Rage Rage,0.0,j4j5h,http://i.imgur.com/EgGGX.png,0.0
3,controversial,Garden Rage,18.0,im1bz,http://i.imgur.com/6yMG6.jpg,0.0
4,controversial,My brother asked me why his plant died today.,0.0,tlllq,http://qkme.me/3p9kkb?id=223835483,0.0
5,controversial,Is gardening making me become a horrible person???,34.0,879ehu,https://i.imgur.com/bgLe7Ai.jpg,0.0
6,controversial,Complaint: I joined this sub to learn how to garden. All I got were people showing off their gardens.,0.0,cps4d9,https://www.reddit.com/r/gardening/comments/cps4d9/complaint_i_joined_this_sub_to_learn_how_to/,0.0
7,controversial,Fuck it,0.0,b9yski,https://imgur.com/bzna1Ve,0.0
8,controversial,Found this guy in my blueberry bush; any advice to keep them away?,2.0,4stgbh,http://imgur.com/BsarHRO,0.0
9,controversial,Is there a more advanced gardening subreddit?,1.0,1k9x3n,https://www.reddit.com/r/gardening/comments/1k9x3n/is_there_a_more_advanced_gardening_subreddit/,0.0
10,gilded,I cannot stop making bouquets! This one was for a newly pregnant friend 😌,4522.0,i8dfyc,https://i.redd.it/21e2bbodmkg51.jpg,0.0
11,gilded,My patio garden,10307.0,i7rbps,https://i.imgur.com/QgYyCVA.jpg,0.0
12,gilded,No one but me seems to care but I grew these all from seeds :( my friends and family just try to brush me off when I mention what I grew. But it’s been such a tough quarantine I just wanted to share the sunshine so I’m sharing it on reddit please enjoy,9421.0,i71e7t,https://www.reddit.com/gallery/i71e7t,0.0
13,gilded,I was asked last year to do a time-lapse with photos of my garden from January to December. This is it. I’m super proud of all my progress so far and look forward to every new change to come. Thank you for all your support on this sub!,209.0,efnibn,https://v.redd.it/wetwev695v641,0.0
14,gilded,Made good use of the strip of land between the sidewalk and the orange pad in front of me house,27.0,i6us2l,https://www.reddit.com/gallery/i6us2l,0.0
15,hot,Friendly Friday Thread,15.0,i5dhed,https://www.reddit.com/r/gardening/comments/i5dhed/friendly_friday_thread/,0.0
16,hot,I cannot stop making bouquets! This one was for a newly pregnant friend 😌,4526.0,i8dfyc,https://i.redd.it/21e2bbodmkg51.jpg,0.0
17,hot,So I had no idea there was such thing as a half umbrella! It was an inexpensive way to provide shade on my narrow beverage patio 😃,2082.0,i8diff,https://i.redd.it/nn5723d6nkg51.jpg,0.0
18,hot,That’s MISTER Tomato Head to you,575.0,i8hyba,https://i.redd.it/93odm58xvlg51.jpg,0.0
19,hot,"Lockdown meant we couldn’t get from our military house to our smallholding for 4 months! But when we did, there were a million berries waiting for us (and a million more weeds!) I’ve spent the last three weeks in berry heaven 😍",180.0,i8l3gr,https://www.reddit.com/gallery/i8l3gr,0.0
20,hot,My container garden is happy with the rain.,228.0,i8fv27,https://i.redd.it/p1a2d385clg51.jpg,0.0
21,hot,Got a good handful of orange dahlias today 🍊,7130.0,i81nsm,https://i.redd.it/hs2kigf89gg51.jpg,0.0
22,hot,First bouquet-making attempt with flowers from the garden. A bit haphazard but I still think it looks okay!,228.0,i8f38j,https://i.imgur.com/99Ih1HL.jpg,0.0
23,hot,Brandywine tomato. Similar size and quite a bit sweeter than my beefsteaks.,98.0,i8ice6,https://v.redd.it/oa91lyf1zlg51,0.0
24,hot,Thats ss me😊🌱🍀💚🤞,99.0,i8hqe6,https://i.redd.it/33zzhg6utlg51.jpg,0.0
25,new,Any idea why this is happening to my peppers?,1.0,i8njcz,https://i.redd.it/q10hqxzvbng51.jpg,0.0
26,new,"I’m so excited, my first dahlia bloom!",2.0,i8nh6n,https://i.redd.it/weikk4kbbng51.jpg,0.0
27,new,"My tomato hornworm from yesterday, today. I was skeptical about these wasps but they are truly badass!!",3.0,i8ncoz,https://i.redd.it/68w2gxw3ang51.jpg,0.0
28,new,I think my purple and green basil cross pollinated last year,9.0,i8nc62,https://i.redd.it/xx5j7rry9ng51.jpg,0.0
29,new,my tomatoes are starting to ripen and my dehydrator is filled,3.0,i8n5c0,https://i.imgur.com/NGcC5o0.png,0.0
30,new,I bought a pack of 5 trader horn bulbs for $1 and these came out 😍,7.0,i8n53r,https://i.redd.it/5pz693q08ng51.jpg,0.0
31,new,Enjoying the fruits of my labour. Finally educated myself about what would work in a tiny shady space and it paid off.,14.0,i8n3a1,https://i.redd.it/ql12pcxi7ng51.jpg,0.0
32,new,BLT's anyone?,4.0,i8n0wb,https://i.redd.it/9586i8mt6ng51.jpg,0.0
33,new,What is a raised row in a garden called?,1.0,i8myl8,https://www.reddit.com/r/gardening/comments/i8myl8/what_is_a_raised_row_in_a_garden_called/,0.0
34,new,Loving the bloom on these dahlia varieties,3.0,i8mx1n,https://imgur.com/a/9rIl3i5,0.0
35,rising,Well my corn was a bust but at least the wild flowers didn't disappoint,22.0,i8m1uo,https://i.redd.it/6ahd82vlxmg51.jpg,0.0
36,rising,Planted a lemon seed. Thought it died because it took 21 days to break the surface. This is day 28. I know it might not produce fruit but that's okay. I just want it to live.,17.0,i8mjwk,https://i.redd.it/lnowln2a2ng51.jpg,0.0
37,rising,Check out these sexy boys I grew.,17.0,i8mpqm,https://i.redd.it/o27k46yu3ng51.jpg,0.0
38,rising,Enjoying the fruits of my labour. Finally educated myself about what would work in a tiny shady space and it paid off.,14.0,i8n3a1,https://i.redd.it/ql12pcxi7ng51.jpg,0.0
39,rising,My tomatoes and peppers are coming along nicely.,6.0,i8lvgh,https://www.reddit.com/gallery/i8lvgh,0.0
40,rising,Red Russian garlic almost dry!,7.0,i8mimb,https://i.redd.it/esp5wm4y1ng51.jpg,0.0
41,rising,I bought a pack of 5 trader horn bulbs for $1 and these came out 😍,7.0,i8n53r,https://i.redd.it/5pz693q08ng51.jpg,0.0
42,rising,"Bought our dream home too late for a summer garden,but still time for fall. Might be a lot of clay, but I'm so excited to start.",8.0,i8moa8,https://i.redd.it/h74d0t2h3ng51.jpg,0.0
43,rising,Who is this guy who took over my compost pile and climbed up a tree?!,6.0,i8lxk2,https://i.redd.it/12vngjtiwmg51.jpg,0.0
44,rising,BLT's anyone?,4.0,i8n0wb,https://i.redd.it/9586i8mt6ng51.jpg,0.0
45,top,Join the Battle for Net Neutrality! Don't let the FCC destroy the internet!,75919.0,7eksjh,https://www.battleforthenet.com/?utm_source=AN&utm_medium=email&utm_campaign=BFTNCallTool&utm_content=voteannouncement&ref=fftf_fftfan1120_30&link_id=0&can_id=185bf77ffd26b044bcbf9d7fadbab34e&email_referrer=email_265020&email_subject=net-neutrality-dies-in-one-month-unless-we-stop-it,0.0
46,top,Dragon fruits on my rooftop garden,50908.0,7ojhzl,https://i.imgur.com/v9KFtIK.jpg,0.0
47,top,"My grandpa says we ""need to get the word out"" about how beautiful his Crepe Myrtle is.",44925.0,6xg9g5,https://i.redd.it/pky375s49bjz.jpg,0.0
48,top,"Hubs deployed and said I could build a garden to keep me busy. Never built anything before, did my best and can't wait to show him.",44218.0,8g20tr,https://imgur.com/NYMnNhs,0.0
49,top,I'm having trouble identifying this plant,32379.0,8lbiol,https://imgur.com/oJ7p1xa,0.0
50,top,"I used to sit in the desert of Afghanistan eating MRE’s daydreaming about having a home with a garden with fresh food. Years later, dream achieved.",31359.0,8vkf9g,https://i.redd.it/o0fpa13bjk711.jpg,0.0
51,top,"Yes, and I am fine with that.",27944.0,6nb8ci,https://i.redd.it/9n2merzlyl9z.jpg,0.0
52,top,This beautiful two toned rose in my garden. I have never seen this before.,26158.0,8p5wdi,https://i.redd.it/dajh27425h211.jpg,0.0
53,top,My night sky petunia!,24347.0,6bra76,https://i.redd.it/iqvjzf7fc4yy.jpg,0.0
54,top,Omg guys I was on the tv! My garden was on bbc news today! Happy boy :) 🌴❤️🌿,23801.0,9j5do1,https://v.redd.it/vn32pne6qmo11,0.0
